{
  "tool": "check_feed",
  "ok": false,
  "exitCode": 1,
  "canonical": "{\n  \"specVersion\": \"taxonomy-v1+acp-extract-2026-07-02+ucp-pin-2026-04-08\",\n  \"matchingMode\": \"synthetic-controlled\",\n  \"simulated\": true,\n  \"findings\": [\n    {\n      \"claim\": {\n        \"id\": \"item-002-v2#existence\",\n        \"source\": \"acp-feed\",\n        \"field\": \"existence\",\n        \"value\": true\n      },\n      \"referenceRowId\": \"item-002-v2\",\n      \"ruleId\": \"LST-AVAIL-HIDDEN-SHOWN\",\n      \"severity\": \"error\",\n      \"category\": \"availability\",\n      \"plainLine\": \"This item is hidden in the merchant's own catalog but is being served to customers.\"\n    },\n    {\n      \"claim\": {\n        \"id\": \"item-004-v1#availability\",\n        \"source\": \"acp-feed\",\n        \"field\": \"availability\",\n        \"value\": \"pre_order\"\n      },\n      \"referenceRowId\": \"item-004-v1\",\n      \"ruleId\": \"LST-AVAIL-STATE\",\n      \"severity\": \"error\",\n      \"category\": \"availability\",\n      \"plainLine\": \"The copy says \\\"pre_order\\\" but the catalog state is in stock (expected \\\"in_stock\\\").\"\n    },\n    {\n      \"claim\": {\n        \"id\": \"item-008-v1#availability\",\n        \"source\": \"acp-feed\",\n        \"field\": \"availability\",\n        \"value\": \"in_stock\"\n      },\n      \"referenceRowId\": \"item-008-v1\",\n      \"ruleId\": \"LST-AVAIL-STATE\",\n      \"severity\": \"error\",\n      \"category\": \"availability\",\n      \"plainLine\": \"The copy says \\\"in_stock\\\" but the catalog state is 86'd/sold out (expected \\\"out_of_stock\\\").\"\n    },\n    {\n      \"claim\": {\n        \"id\": \"item-002-v1#invariants\",\n        \"source\": \"acp-feed\",\n        \"field\": \"invariants\",\n        \"value\": {\n          \"price\": \"22.00\",\n          \"is_eligible_search\": false,\n          \"is_eligible_checkout\": true\n        }\n      },\n      \"referenceRowId\": \"item-002-v1\",\n      \"ruleId\": \"LST-XF-CHECKOUT-SEARCH\",\n      \"severity\": \"error\",\n      \"category\": \"cross-field-invariant\",\n      \"plainLine\": \"The row is checkout-eligible but not search-eligible — the extracted invariant requires checkout ⇒ search.\"\n    },\n    {\n      \"claim\": {\n        \"id\": \"item-005-v2#title\",\n        \"source\": \"acp-feed\",\n        \"field\": \"title\",\n        \"value\": \"Margherita…\"\n      },\n      \"referenceRowId\": \"item-005-v2\",\n      \"ruleId\": \"LST-ENC-TRUNC\",\n      \"severity\": \"warn\",\n      \"category\": \"encoding\",\n      \"plainLine\": \"The name is cut off on the serving copy: \\\"Margherita…\\\" vs the real \\\"Margherita Pizza (Medium)\\\".\"\n    },\n    {\n      \"claim\": {\n        \"id\": \"item-004-v3#title\",\n        \"source\": \"acp-feed\",\n        \"field\": \"title\",\n        \"value\": \"JalapeÃ±o Poppers (Large)\"\n      },\n      \"referenceRowId\": \"item-004-v3\",\n      \"ruleId\": \"LST-ENC-UTF8\",\n      \"severity\": \"warn\",\n      \"category\": \"encoding\",\n      \"plainLine\": \"The name is garbled by a text-encoding error: served \\\"JalapeÃ±o Poppers (Large)\\\" vs the real \\\"Jalapeño Poppers (Large)\\\".\"\n    },\n    {\n      \"claim\": {\n        \"id\": \"ghost-001#existence\",\n        \"source\": \"acp-feed\",\n        \"field\": \"existence\",\n        \"value\": true\n      },\n      \"referenceRowId\": \"catalog-meta\",\n      \"ruleId\": \"LST-EXIST-GHOST\",\n      \"severity\": \"error\",\n      \"category\": \"existence\",\n      \"plainLine\": \"The copy serves \\\"Phantom Platter (simulated ghost item)\\\" but no such item exists in the merchant's catalog.\"\n    },\n    {\n      \"claim\": {\n        \"id\": \"item-003-v1#existence\",\n        \"source\": \"acp-feed\",\n        \"field\": \"existence\",\n        \"value\": false\n      },\n      \"referenceRowId\": \"item-003-v1\",\n      \"ruleId\": \"LST-EXIST-MISSING\",\n      \"severity\": \"error\",\n      \"category\": \"existence\",\n      \"plainLine\": \"\\\"Café Latte (Small)\\\" exists in the merchant's catalog but is missing from the serving copy.\"\n    },\n    {\n      \"claim\": {\n        \"id\": \"legacy-pos-4471#existence\",\n        \"source\": \"acp-feed\",\n        \"field\": \"existence\",\n        \"value\": true\n      },\n      \"referenceRowId\": \"item-003-v2\",\n      \"ruleId\": \"LST-IDENT-ID-MISMATCH\",\n      \"severity\": \"error\",\n      \"category\": \"identity\",\n      \"plainLine\": \"The copy keys this row as \\\"legacy-pos-4471\\\" but the catalog row is \\\"item-003-v2\\\" — same item, mismatched identity (resolved by exact name).\"\n    },\n    {\n      \"claim\": {\n        \"id\": \"item-004-v2#variant_dict\",\n        \"source\": \"acp-feed\",\n        \"field\": \"variant_dict\",\n        \"value\": {\n          \"group\": \"item-004\",\n          \"dict\": {\n            \"variation\": \"Small\"\n          }\n        }\n      },\n      \"referenceRowId\": \"item-004-v2\",\n      \"ruleId\": \"LST-IDENT-MODIFIER-AMBIG\",\n      \"severity\": \"error\",\n      \"category\": \"identity\",\n      \"plainLine\": \"The variant label says \\\"Small\\\" but this row is the \\\"Medium\\\" variation — variants of this item can no longer be told apart.\"\n    },\n    {\n      \"claim\": {\n        \"id\": \"item-001-v1#price.amount\",\n        \"source\": \"acp-feed\",\n        \"field\": \"price.amount\",\n        \"value\": \"2150\"\n      },\n      \"referenceRowId\": \"item-001-v1\",\n      \"ruleId\": \"LST-PRICE-CENTS-AS-DECIMAL\",\n      \"severity\": \"error\",\n      \"category\": \"price\",\n      \"plainLine\": \"The price is serialized in cents (2150) where dollars are expected (21.50) — a 100× overstatement.\"\n    },\n    {\n      \"claim\": {\n        \"id\": \"item-001-v2#price.currency\",\n        \"source\": \"acp-feed\",\n        \"field\": \"price.currency\",\n        \"value\": \"usd\"\n      },\n      \"referenceRowId\": \"item-001-v2\",\n      \"ruleId\": \"LST-PRICE-CURRENCY-FORM\",\n      \"severity\": \"warn\",\n      \"category\": \"price\",\n      \"plainLine\": \"The currency code is malformed: \\\"usd\\\" instead of ISO-4217 \\\"USD\\\".\"\n    },\n    {\n      \"claim\": {\n        \"id\": \"item-001-v3#invariants\",\n        \"source\": \"acp-feed\",\n        \"field\": \"invariants\",\n        \"value\": {\n          \"price\": \"27.50\",\n          \"sale_price\": \"28.50\",\n          \"is_eligible_search\": true,\n          \"is_eligible_checkout\": true\n        }\n      },\n      \"referenceRowId\": \"item-001-v3\",\n      \"ruleId\": \"LST-PRICE-SALE-GT\",\n      \"severity\": \"error\",\n      \"category\": \"price\",\n      \"plainLine\": \"The sale price 28.50 is higher than the regular price 27.50 — a \\\"sale\\\" that costs more.\"\n    },\n    {\n      \"claim\": {\n        \"id\": \"item-006-v1#price.amount\",\n        \"source\": \"acp-feed\",\n        \"field\": \"price.amount\",\n        \"value\": \"12.00\"\n      },\n      \"referenceRowId\": \"item-006-v1\",\n      \"ruleId\": \"LST-PRICE-VALUE\",\n      \"severity\": \"error\",\n      \"category\": \"price\",\n      \"plainLine\": \"The served price 12.00 does not match the catalog price 10.00.\"\n    },\n    {\n      \"claim\": {\n        \"id\": \"item-004-v1#availability_date\",\n        \"source\": \"acp-feed\",\n        \"field\": \"availability_date\",\n        \"value\": \"2026-02-01T00:00:00Z\"\n      },\n      \"referenceRowId\": \"item-004-v1\",\n      \"ruleId\": \"LST-STALE-AVAILDATE\",\n      \"severity\": \"warn\",\n      \"category\": \"staleness\",\n      \"plainLine\": \"The pre-order availability date 2026-02-01T00:00:00Z already passed (catalog as-of 2026-07-03T00:00:00Z) — the promise is stale.\"\n    },\n    {\n      \"claim\": {\n        \"id\": \"item-003-v3#expiration_date\",\n        \"source\": \"acp-feed\",\n        \"field\": \"expiration_date\",\n        \"value\": \"2026-01-01T00:00:00Z\"\n      },\n      \"referenceRowId\": \"item-003-v3\",\n      \"ruleId\": \"LST-STALE-EXPIRED\",\n      \"severity\": \"warn\",\n      \"category\": \"staleness\",\n      \"plainLine\": \"This row expired 2026-01-01T00:00:00Z but is still served (catalog as-of 2026-07-03T00:00:00Z).\"\n    }\n  ],\n  \"ok\": false\n}\n"
}
